{
  "slug": "golf",
  "campaign": "golf-2017",
  "year": 2017,
  "make": "Volkswagen",
  "make_short": "VW",
  "model": "Golf R-Line Wagon",
  "transmission": "Automatic",
  "body": "Wagon",
  "built": "Jun 2017",
  "km": 62937,
  "price": 19900,
  "price_note": "Firm, no offers",
  "engine": "TSI turbo petrol",
  "trust": ["R-Line sports package", "Touchscreen & navigation", "Park Assist & parking sensors"],
  "description": "Sporty, comfortable and practical European wagon, presenting extremely well inside and out with only 62,937 km. TSI turbo petrol with automatic transmission and the R-Line sports package: R-Line alloy wheels, LED headlights, touchscreen multimedia with navigation, reverse camera, front & rear parking sensors, Park Assist, dual-zone climate control, push-button start, electronic parking brake with Auto Hold, and a spacious boot. Workshop-inspected and passed the required government inspection.",
  "ppsr_listed": true,
  "repaired": false,
  "rego_months": 3,
  "status": "available",
  "photos": [
    { "file": "golf-01.jpg", "alt": "front angle",                                      "role": "hero" },
    { "file": "golf-02.jpg", "alt": "side view",                                        "role": "side" },
    { "file": "golf-03.jpg", "alt": "front angle, other side",                          "role": "front" },
    { "file": "golf-04.jpg", "alt": "rear angle",                                       "role": "rear34" },
    { "file": "golf-05.jpg", "alt": "rear",                                             "role": "detail" },
    { "file": "golf-06.jpg", "alt": "R-Line badge",                                     "role": "detail" },
    { "file": "golf-07.jpg", "alt": "R-Line alloy wheel",                               "role": "detail" },
    { "file": "golf-08.jpg", "alt": "driver's view, dashboard and sports steering wheel", "role": "dash" },
    { "file": "golf-09.jpg", "alt": "touchscreen with reverse camera and automatic gearshift", "role": "detail" },
    { "file": "golf-10.jpg", "alt": "front sports seats",                               "role": "detail" },
    { "file": "golf-11.jpg", "alt": "rear seats",                                       "role": "rear_seats" },
    { "file": "golf-12.jpg", "alt": "boot space",                                       "role": "boot" },
    { "file": "golf-13.jpg", "alt": "odometer showing 62,937 km",                       "role": "odometer" },
    { "file": "golf-14.jpg", "alt": "engine bay",                                       "role": "engine" }
  ]
}
